{
  "name": "pi",
  "description": "pi coding agent: minimal agent harness by @earendil-works — unified LLM API, agent loop, TUI, coding agent CLI. Supports any provider (OpenRouter, Anthropic, DeepSeek, Copilot, etc.).",
  "detectionSignals": [
    ".pi",
    "~/.pi/agent"
  ],
  "requires": [],
  "commands": {
    "run": "pi",
    "build": "pi doctor",
    "test": "pi doctor"
  }
}