{
  "name": "azure",
  "description": "Microsoft Azure cloud platform: Functions, Static Web Apps, Storage, Application Insights, managed identity, Key Vault.",
  "detectionSignals": ["azure.yaml", "host.json", "*.bicep", "azurerm provider block in *.tf", "local.settings.json"],
  "requires": [],
  "commands": {}
}
